id,title,slug,tier,description,street1,street2,city,state,zip,phone,webUrl,linkedin,categories,category_ids
695116,Parmer Woods at North Austin,parmer-woods-at-north-austin,Engage,"At Parmer Woods at North Austin, we’ve been making residents’ lives better for over 20 years. You’ll feel at home in our tree-lined community; enjoy relaxing in our inviting courtyard and savoring the chef’s delicious dining. You’re lucky if you’re a hops fan; residents brew their own Parmer Woods Beer! We’re close to shopping, dining, worship centers, and nature escapes like Walnut Creek Park. See why many Austin seniors choose Parmer Woods to call their next home.

You can find us playing bingo, chatting at happy hour, relaxing in the courtyard, or catching up over nutritious and comforting meals. Seniors in North Austin can let go of life’s hassles and enjoy retirement living with the benefit of individualized support. We’re dedicated to serving your assisted living or memory care needs.

Residents enjoy the ability to say goodbye to chores and loneliness. New friends are waiting, and a team of dedicated senior experts is ready to provide unparalleled service in our assisted living community.

Calling us home means choosing an active and independent lifestyle for you or a loved one. Seniors who live here continue to grow and maximize their abilities.",12429 Scofield Farms Dr,,Austin,TX,78758,512-835-9080,https://www.pegasusseniorliving.com/parmer-woods-at-north-austin/,,"Health Care, Assisted & Independent Living","328, 52"
852807,Recovery Unplugged,recovery-unplugged,Engage,<p>Recovery Unplugged is a behavioral health organization that specializes in music-based therapy for individuals dealing with mental health and/or substance abuse issues. Our approach combines traditional evidence based intervention methods with the power of music to engage and motivate individuals in their recovery process.</p>,5419 S Congress Ave,,Austin,TX,78745,1-800-557-3422,https://www.recoveryunplugged.com,https://www.linkedin.com/company/recovery-unplugged/mycompany/verification/,"Health Care, Counseling & Mental Health","328, 83"
29052,RESTART CBD,restart-cbd,Engage,,2521 Rutland Dr #150A,,Austin,TX,78758,512-843-7223,https://restartcbd.com,https://www.linkedin.com/company/34222909,"Health Care, Health & Wellness, Shopping & Speciality Retail, Specialty Retail","328, 132, 333, 229"
275998,Samaritan Center,samaritan-center,Engage,"The Samaritan Center has been serving individuals and families in Central Texas since 1974. We envision a healthy and compassionate community where every individual achieves mental, physical, spiritual and social well-being. We heal hearts, provide hope, and enhance lives with a holistic approach to mental health for all ages, whole families and the military community.

The Samaritan Center also partners with the Military Veteran Peer Network (MVPN) to provide additional support for our veterans and their families.",8956 Research Blvd,Bldg 2,Austin,TX,78758,512-451-7337 x212,https://samaritan-center.org,https://www.linkedin.com/company/samaritan-center-for-counseling-and-pastoral-care---austin/,"Health Care, Counseling & Mental Health","328, 83"
420573,SenoPro,ebisu-supplies,Engage,"<p>SenoPro is an Austin-based company supporting private-sector science, biotech, and laboratory environments. We work across health, research, and life sciences settings to support operational readiness and continuity through reliable medical, safety, and scientific consumables. SenoPro is actively building long-term partnerships across science and biotech verticals, with a focus on collaboration, transparency, and shared problem-solving.</p><p>Our virtual coffee series reflects this commitment by creating space for open dialogue, relationship-building, and knowledge exchange across the life sciences ecosystem.</p><p>From essential medical equipment to a broad array of wholesale products, we understand that public sector needs often align with those of the private sector, and we are here to bridge that gap efficiently and effectively.</p>",9600 Great Hills Trail,,Austin,TX,78759,+1 512-669-1062,https://seno.pro,https://www.linkedin.com/company/senoprotx,"Health Care, Bio/Medical","328, 59"
628370,Sleep Cycle Center,sleep-cycle-center,Engage,"We accelerate health in communities by empowering patients to know their sleep apnea status and understand their treatment options. Our organization aims to improve the quality and longevity of life. We accomplish this by evaluating, educating, treating, and eliminating complications related to obstructive sleep apnea.",10900 Research Blvd 140 c,,Austin,TX,78759,5126450818,https://www.sleepcyclecenters.com/,,"Health Care, Medical Services","328, 163"
174520,SonderMind,sondermind,Engage,"<p>SonderMind makes it easier for people who are searching for a mental health professional to find licensed therapists who are available for in-person or video sessions. If you’re trying to find that perfect therapist in Colorado, Texas, or Arizona visit https://sondermind.com.</p><p>SonderMind also connects mental health providers to networks of new patients, helps with payor credentialing, manages the billings and claims processes, and guarantees instant payment on claims. If you are a licensed therapist and would like to grow a practice with the type of clients and caseload you’ve always wanted visit https://sondermind.com/why-sondermind/therapists.</p>",,,,,,844-257-0989,http://www.sondermind.com,https://www.linkedin.com/company/sondermind/about/,"Health Care, Counseling & Mental Health","328, 83"
3868,Strictly Pediatrics Surgery Center,strictly-pediatrics-surgery-center,Engage,,1301 Barbara Jordan Boulevard,Suite 100,Austin,TX,78723,(512) 474-7337,http://www.strictlypediatrics.com,,"Health Care, Hospitals","328, 136"
903032,The Tox Austin,the-tox-austin,Engage,"The Tox Technique is a blend of different modalities, set out to detoxify your body from the inside out.  The Tox is a body contouring technique that work directly with your lymphatic and digestive system with our manual technique to give you a long lasting, full body sculpting detox.",360 Nueces St The 360 Tower,,Austin,TX,78701,5124688411,https://www.thetoxtechnique.com,,"Health Care, Health & Wellness, Personal Services & Care, Salons & Spas","328, 132, 334, 221"
4195,The YMCA of Austin,the-ymca-of-austin,Engage,,55 N Interstate Hwy 35,,Austin,TX,78702,(512) 322-9622,http://www.austinymca.org,,"Family, Community & Non-Profit, Non Profit Organizations, Health Care, Health & Wellness","325, 180, 328, 132"
6228,Tricity Pain Associates,tricity-pain-associates,Engage,,4544 S. Lamar Blvd ,Suite 740,Austin,TX,78745,210-240-1983,http://sapaindoc.com,,"Health Care, Physicians","328, 198"
517973,VHA-Vocational Rehabilitation Services,vha-vocational-rehabilitation-services,Engage,"At VA Central Texas Healthcare System, our health care teams are deeply experienced and guided by the needs of Veterans, their families, and caregivers. Find a health facility near you, and manage your health online. Sign up for community events and updates.",1901 S 1st St,,Temple,TX,76504,254-743-4187,https://www.centraltexas.va.gov/,,"Health Care, Rehabilitation & Hospice","328, 214"
